{
  "run_id": "751dcb7ae81b",
  "created_at": "2025-12-29T09:39:09.410879+00:00",
  "status": "READY_FOR_REVIEW",
  "platform": "instagram",
  "asset_path": "/Users/bhaveshchatlani/IGAgent/runs/751dcb7ae81b/05_image.png",
  "caption": "AAPL: 273.4 \u2193 -0.15%\nTSLA: 475.19 \u2193 -2.10%\nAs of: 2025-12-29T09:39:09.410879+00:00",
  "claims": [
    "AAPL: 273.4 \u2193 -0.15%",
    "TSLA: 475.19 \u2193 -2.10%",
    "As of: 2025-12-29T09:39:09.410879+00:00"
  ],
  "evidence": [
    {
      "claim": "AAPL: 273.4 \u2193 -0.15%",
      "source": "yfinance_close_prevclose | close_vs_prev_close"
    },
    {
      "claim": "TSLA: 475.19 \u2193 -2.10%",
      "source": "yfinance_close_prevclose | close_vs_prev_close"
    },
    {
      "claim": "As of: 2025-12-29T09:39:09.410879+00:00",
      "source": "yfinance_close_prevclose | close_vs_prev_close"
    }
  ],
  "scheduled_for": null,
  "attempts": 0,
  "last_error": null
}